{
  "schemaVersion": 1,
  "kind": "gamebox-catalog",
  "status": "bootstrap",
  "repository": {
    "owner": "qiaozhi-4",
    "name": "GameBox-Release",
    "visibility": "public",
    "defaultBranch": "main"
  },
  "endpoints": {
    "appLatest": "https://raw.githubusercontent.com/qiaozhi-4/GameBox-Release/main/app/latest.json",
    "coreLatest": "https://raw.githubusercontent.com/qiaozhi-4/GameBox-Release/main/so/core/latest.json",
    "gamesIndex": "https://raw.githubusercontent.com/qiaozhi-4/GameBox-Release/main/so/games/index.json",
    "home": "https://raw.githubusercontent.com/qiaozhi-4/GameBox-Release/main/content/home.md",
    "appContentBase": "https://raw.githubusercontent.com/qiaozhi-4/GameBox-Release/main/content/apps/"
  },
  "app": {
    "componentId": "gamebox-app",
    "latestUrl": "https://raw.githubusercontent.com/qiaozhi-4/GameBox-Release/main/app/latest.json"
  },
  "native": {
    "core": {
      "soId": "core",
      "latestUrl": "https://raw.githubusercontent.com/qiaozhi-4/GameBox-Release/main/so/core/latest.json"
    },
    "gamesIndexUrl": "https://raw.githubusercontent.com/qiaozhi-4/GameBox-Release/main/so/games/index.json"
  },
  "content": {
    "homeUrl": "https://raw.githubusercontent.com/qiaozhi-4/GameBox-Release/main/content/home.md",
    "appBaseUrl": "https://raw.githubusercontent.com/qiaozhi-4/GameBox-Release/main/content/apps/"
  },
  "supportedAbis": [
    "arm64-v8a"
  ]
}
